{
  "payloadType": "application/vnd.in-toto+json",
  "payload": "eyJfdHlwZSI6Imh0dHBzOi8vaW4tdG90by5pby9TdGF0ZW1lbnQvdjEiLCJzdWJqZWN0IjpbeyJuYW1lIjoiZXhhbXBsZS1tYW5pZmVzdC5qc29uIiwiZGlnZXN0Ijp7InNoYTI1NiI6IjFmYjUyMGE3ZjY4NzFkMzFkMDRlZjZmMDY3NjY2MzAxOGZmYTM4NzAzZDVmOGMwMDlhYjk5MzdkY2NiMDRhZjUifX1dLCJwcmVkaWNhdGVUeXBlIjoiaHR0cHM6Ly9pcGxhbmljLmFpL2F0dGVzdGF0aW9ucy91YWxmLXF1YWxpZmljYXRpb24vdjEiLCJwcmVkaWNhdGUiOnsiZGF0YXNldElkIjoiZGF0YXNldC11YWxmLWRlbW8tMDAxIiwicHJvZmlsZSI6InVhbGYtZGF0YXNldC92MS4xIiwicXVhbGl0eVJlcG9ydFNoYTI1NiI6ImU2ZjY2Yzk2ZDg2ZjgwNDdkZmQ4ODdhZjhlMGVjODU5NzVjODc5ZDc1YTRmMTBkM2RkZTZhYWIzMTNlMTA3OWIiLCJyaWdodHNTdGF0dXMiOiJjbGVhcmVkIiwiaW50ZW5kZWRVc2VzIjpbImZvcm1hdCB2YWxpZGF0aW9uIiwiaW50ZWdyYXRpb24gdGVzdGluZyJdLCJwcm9oaWJpdGVkVXNlcyI6WyJyZXByZXNlbnRhdGlvbiBhcyBwcm9kdWN0aW9uIHRyYWluaW5nIGludmVudG9yeSJdLCJ2YWxpZGF0b3IiOiJ2ZXJpZnkucHkvMS4xIiwidmFsaWRhdGVkQXQiOiIyMDI2LTA4LTAzVDEyOjAwOjAwWiIsInNpZ25lclJvbGUiOiJkYXRhc2V0LXByb2R1Y2VyIn19",
  "signatures": [
    {
      "keyid": "ualf-dsse-demo-1",
      "sig": "Em3XdWIDINEKvN4Bi9sjWqFTETdb0gAgKs2lNR0+3C+HpmnLCm9pKPFjlu3Hpl7WZgYfNqMsbuM63vFaGpyjDg=="
    }
  ],
  "verification": {
    "algorithm": "ed25519",
    "public_key": "khpi1qlgWvOzC8CugTIa/MTih+qbc4o8JhHkpHNHxMk=",
    "registry": "https://example.invalid/keys"
  }
}
